<flow-actions xmlns:xsi="http://www.w3.org/2001/XMLSchema-instance" xsi:noNamespaceSchemaLocation="https://gitlab.shopware.com/shopware/6/product/platform/-/raw/next-19083/update-app-manifest-xsd-for-flow-action/src/Core/Framework/App/FlowAction/Schema/flow-action-1.0.xsd">
    <flow-action>
        <meta>
            <name>telegram.send.message</name>
            <label>Telegram send message</label>
            <label lang="de-DE">Telegram send message DE</label>
            <label lang="nl-NL">Telegram send message NL</label>
            <headline>The headline App Flow Action</headline>
            <headline lang="de-DE">Die Ãœberschrift App Flow Action</headline>
            <description>Telegram send message description</description>
            <description lang="de-DE">Telegramm senden Nachrichtenbeschreibung</description>
            <url>https://test-flow.com</url>
            <sw-icon>default-communication-speech-bubbles</sw-icon>
            <requirements>orderAware</requirements>
            <requirements>customerAware</requirements>
        </meta>
        <headers>
            <parameter type="string" name="content-type" value="application/json"/>
        </headers>
        <parameters>
            <parameter type="string" name="message" value="string message"/>
        </parameters>
        <config>
            <input-field type="text">
                <name>text</name>
                <label>Text</label>
                <label lang="de-DE">Text DE</label>
                <place-holder>Enter Text...</place-holder>
                <place-holder lang="de-DE">Enter Text DE...</place-holder>
                <required>true</required>
                <defaultValue>Hello</defaultValue>
                <helpText>Help Text</helpText>
                <helpText lang="de-DE">Help DE</helpText>
            </input-field>
        </config>
    </flow-action>
</flow-actions>
